{
  "schemaVersion": 2,
  "workerId": "gsharp-stable",
  "languageId": "gsharp",
  "toolchainIds": ["gsharp-stable", "gsharp-legacy-0.3.8"],
  "protocolVersion": "1.0",
  "capabilities": [
    "artifact",
    "code-actions",
    "compile-check",
    "completion",
    "diagnostics",
    "document-symbols",
    "folding-ranges",
    "hover",
    "lsp",
    "managed-pe",
    "multi-file",
    "semantic-tokens",
    "signature-help"
  ],
  "producedArtifactFormats": [
    "dotnet-managed-pe-v1"
  ],
  "supportedReferenceSetIds": [
    "net10-ref"
  ],
  "limits": {
    "maximumFiles": 32,
    "maximumSourceUtf8Bytes": 1048576,
    "maximumArtifactBytes": 16777216,
    "maximumConcurrentBuilds": 8,
    "maximumBuildMilliseconds": 20000,
    "maximumLspMessageBytes": 4194304
  }
}
